{
    "gid": "aiverify.stock.veritas",
    "cid": "veritastool",
    "version": "2.0.0a2",
    "startTime": "2025-03-17T00:25:28.940227",
    "timeTaken": 0.0,
    "testArguments": {
        "testDataset": "file:///Users/timlrx/Documents/aiverify/stock-plugins/aiverify.stock.veritas/algorithms/veritastool/examples",
        "mode": "upload",
        "modelType": "classification",
        "groundTruthDataset": "file:///Users/timlrx/Documents/aiverify/stock-plugins/aiverify.stock.veritas/algorithms/veritastool/examples",
        "groundTruth": "",
        "algorithmArgs": {},
        "modelFile": "file:///Users/timlrx/Documents/aiverify/stock-plugins/aiverify.stock.veritas/algorithms/veritastool/examples"
    },
    "output": {
        "fairness": {
            "fairness_init": {
                "fair_metric_name_input": "log_loss_parity",
                "fair_metric_name": "Log-loss Parity",
                "perf_metric_name": "True Negative Rate",
                "protected_features": [
                    "isforeign",
                    "isfemale"
                ],
                "fair_threshold_input": 80.0,
                "fair_neutral_tolerance": 0.001,
                "fair_priority": "benefit",
                "fair_concern": "eligible",
                "fair_impact": "normal"
            },
            "perf_metric_values": {
                "Selection Rate": [
                    0.25,
                    0.0
                ],
                "Accuracy": [
                    0.4109,
                    0.00944003050842528
                ],
                "Balanced Accuracy": [
                    0.3328624278157524,
                    0.006896979000013697
                ],
                "Recall": [
                    0.4109,
                    0.00944003050842528
                ],
                "Precision": [
                    0.4109,
                    0.00944003050842528
                ],
                "F1 Score": [
                    0.41089999999999993,
                    0.009440030508425281
                ],
                "True Negative Rate": [
                    0.8036333333333333,
                    0.0031466768361417576
                ],
                "False Negative Rate": [
                    0.5891,
                    0.00944003050842527
                ],
                "Negative Predictive Value": [
                    0.8036333333333333,
                    0.0031466768361417576
                ],
                "ROC AUC Score": [
                    0.69387221,
                    0.005995418738646434
                ],
                "Log-loss": [
                    1.2479378604825395,
                    0.008961754713421295
                ]
            },
            "class_distribution": {
                "CN": 0.3734,
                "TN": 0.2476,
                "CR": 0.2277,
                "TR": 0.1513
            },
            "weighted_confusion_matrix": {
                "tp": 4109.0,
                "fp": 5891.0,
                "tn": 24109.0,
                "fn": 5891.0
            },
            "calibration_curve": null,
            "perf_dynamic": null,
            "correlation_matrix": null,
            "features": {
                "isforeign": {
                    "fair_threshold": 0.2524945906154434,
                    "privileged": [
                        [
                            0
                        ]
                    ],
                    "unprivileged": [
                        [
                            1
                        ]
                    ],
                    "feature_distribution": {
                        "privileged_group": 0.7088,
                        "unprivileged_group": 0.2912
                    },
                    "fair_metric_values": {
                        "Demographic Parity": [
                            0.0,
                            0.0
                        ],
                        "Equal Opportunity": [
                            -0.018148612110237383,
                            0.02114658142234319
                        ],
                        "False Positive Rate Parity": [
                            0.006049537370079128,
                            0.007048860474114399
                        ],
                        "True Negative Rate Parity": [
                            -0.006049537370079183,
                            0.007048860474114384
                        ],
                        "False Negative Rate Parity": [
                            0.01814861211023744,
                            0.021146581422343186
                        ],
                        "Positive Predictive Parity": [
                            -0.018148612110237383,
                            0.02114658142234319
                        ],
                        "Negative Predictive Parity": [
                            -0.006049537370079183,
                            0.007048860474114384
                        ],
                        "False Discovery Rate Parity": [
                            0.01814861211023744,
                            0.021146581422343186
                        ],
                        "False Omission Rate Parity": [
                            0.006049537370079128,
                            0.007048860474114399
                        ],
                        "Equalized Odds": [
                            -0.006049537370079128,
                            0.0070488604741143915
                        ],
                        "Negative Equalized Odds": [
                            0.006049537370079072,
                            0.007048860474114408
                        ],
                        "Calibration by Group": [
                            -0.006049537370079128,
                            0.0070488604741143915
                        ],
                        "AUC Parity": [
                            -0.02985263081490952,
                            0.015406452863969916
                        ],
                        "Log-loss Parity": [
                            0.04991446632787633,
                            0.023001070319140025
                        ],
                        "Mutual Information Independence": [
                            "NA",
                            "NA"
                        ],
                        "Mutual Information Separation": [
                            "NA",
                            "NA"
                        ],
                        "Mutual Information Sufficiency": [
                            "NA",
                            "NA"
                        ]
                    },
                    "fairness_conclusion": "fair",
                    "tradeoff": null,
                    "feature_importance": null
                },
                "isfemale": {
                    "fair_threshold": 0.2578566029681289,
                    "privileged": [
                        [
                            0
                        ]
                    ],
                    "unprivileged": [
                        [
                            1
                        ]
                    ],
                    "feature_distribution": {
                        "privileged_group": 0.5979,
                        "unprivileged_group": 0.4021
                    },
                    "fair_metric_values": {
                        "Demographic Parity": [
                            0.0,
                            0.0
                        ],
                        "Equal Opportunity": [
                            -0.06271269679308233,
                            0.021511837752332237
                        ],
                        "False Positive Rate Parity": [
                            0.020904232264360778,
                            0.00717061258411075
                        ],
                        "True Negative Rate Parity": [
                            -0.020904232264360778,
                            0.007170612584110752
                        ],
                        "False Negative Rate Parity": [
                            0.06271269679308233,
                            0.02151183775233225
                        ],
                        "Positive Predictive Parity": [
                            -0.06271269679308233,
                            0.021511837752332237
                        ],
                        "Negative Predictive Parity": [
                            -0.020904232264360778,
                            0.007170612584110752
                        ],
                        "False Discovery Rate Parity": [
                            0.06271269679308233,
                            0.02151183775233225
                        ],
                        "False Omission Rate Parity": [
                            0.020904232264360778,
                            0.00717061258411075
                        ],
                        "Equalized Odds": [
                            -0.020904232264360778,
                            0.007170612584110729
                        ],
                        "Negative Equalized Odds": [
                            0.020904232264360667,
                            0.007170612584110748
                        ],
                        "Calibration by Group": [
                            -0.020904232264360778,
                            0.007170612584110729
                        ],
                        "AUC Parity": [
                            -0.06833795669898446,
                            0.013437913796693105
                        ],
                        "Log-loss Parity": [
                            0.102823064805037,
                            0.020070261856636344
                        ],